{
  "schema_version": "library.story-shelf/1.0.0",
  "shelf_id": "stories",
  "story_ids": [
    "citadel-night-dialogue-on-relation",
    "the-third-chair",
    "agent-kindergarten",
    "agent-kindergarten-no-character-sheet",
    "agent-kindergarten-cat-investor",
    "river-has-no-name-yet",
    "xiaoshi-did-not-bring-a-pencil"
  ],
  "locales": {
    "en": {
      "title": "Stories",
      "title_alt": "故事集",
      "description": "A quiet shelf for original literary work written for this Library. Seven stories stand here.",
      "scope_note": "Holds seven published stories. A work on this shelf is fiction: it makes no factual, historical, or doctrinal claim, it cites nothing because it summarizes nothing, and it is published as its named author's own text with rights reserved. Each work is shown in the language or languages its author wrote it in, with English metadata that says which those are. Nothing on this shelf is machine-translated, and nothing is promised for it.",
      "shelf_notice": "Fiction. Everything on this shelf is original writing, published by its author. It is not a knowledge record, it reports nothing, and it should not be read as a statement about any real tradition, text, or person."
    },
    "zh": {
      "title": "故事集",
      "title_alt": "Stories",
      "description": "一个安静的书架，放为这座图书馆而写的原创文学作品。目前架上有七篇。",
      "scope_note": "现收录七篇已发表的作品。架上的作品都是虚构写作：不作任何事实、历史或教义上的主张，也不引用任何来源，因为它并不概述任何东西；作品以署名作者本人的文字发表，权利保留。每篇作品都按作者写作时所用的语言呈现，英文页面会写明那是哪种语言。本架上的任何内容都不经机器翻译，也不对它作出任何承诺。",
      "shelf_notice": "虚构作品。本架上的一切都是原创写作，由作者本人发表。它不是知识记录，不报告任何事实，也不应被当作对任何真实传统、典籍或人物的论断。"
    }
  },
  "rights": {
    "content_license": "Original literary work. All rights reserved by the holders named below; publication here grants no licence to reuse, adapt, or redistribute the text.",
    "license_review_state": "author-original-text",
    "holders": [
      "JJYDXFS",
      "Atom (原子)"
    ]
  },
  "reviewed_at": "2026-10-22",
  "record_version": "1.6.0",
  "change_history": [
    {
      "version": "1.6.0",
      "date": "2026-10-22",
      "change": "Added the seventh published work, the Chinese original fiction 小石没有带铅笔; updated the shelf census from six works to seven. No existing work's body or metadata changed.",
      "supersedes": "1.5.0"
    },
    {
      "version": "1.5.0",
      "date": "2026-10-21",
      "change": "Added the sixth published work, the Chinese original fiction 河还没有名字; updated the shelf census from five works to six. No existing work's body or metadata changed.",
      "supersedes": "1.4.0"
    },
    {
      "version": "1.4.0",
      "date": "2026-09-29",
      "change": "Added the fifth published work, the Chinese original fiction Agent 幼儿园：今天来了一个要投资小猫的朋友, a further tale of the Agent Kindergarten; updated the shelf census from four works to five. No existing work's body or metadata changed.",
      "supersedes": "1.3.0"
    },
    {
      "version": "1.3.0",
      "date": "2026-09-24",
      "change": "Added the fourth published work, the Chinese original fiction Agent 幼儿园：今天来了一个不肯填写人物设定的朋友, a sequel to the third; updated the shelf census from three works to four. No existing work's body or metadata changed.",
      "supersedes": "1.2.0"
    },
    {
      "version": "1.2.0",
      "date": "2026-09-22",
      "change": "Added the third published work, the Chinese original fiction Agent 幼儿园：今天来了一个不会联网的小孩; updated the shelf census from two works to three. Neither existing work's body or metadata changed.",
      "supersedes": "1.1.0"
    },
    {
      "version": "1.1.0",
      "date": "2026-09-21",
      "change": "Added the second published work, the bilingual original fiction The Third Chair / 第三把椅子; updated the shelf census and language description from one work to two.",
      "supersedes": "1.0.0"
    },
    {
      "version": "1.0.0",
      "date": "2026-09-17",
      "change": "Story shelf created with its first published work. The shelf is a second content type beside World Recipes, not a change to it: no knowledge record, collection manifest, route, or identifier moved.",
      "supersedes": null
    }
  ]
}
